Σχόλια,Συναίσθημα,Ποσοστό %,Ημερομηνία
το σερβις ηταν αξιολάτρευτο,Θετικό,100.0,2025-05-25 17:27:49
το σερβις ηταν απαραδεκτο !,Αρνητικό,100.0,2025-05-25 17:28:32
το σερβις ηταν χαλια !,Αρνητικό,90.0,2025-05-25 17:29:06
το σερβις ηταν Χάλια !,Αρνητικό,100.0,2025-05-25 17:30:01
το φαγητο ηταν καλο,Θετικό,90.0,2025-05-30 20:09:30
ταχυτατο σερβις!,Θετικό,100.0,2025-06-03 22:56:53
Απιστευτο φαγητο !,Θετικό,100.0,2025-06-03 22:57:27
Αυτό το σχόλιο είναι ένα καλό σχόλιο για Υπηρεσίες.,Θετικό,100.0,2025-06-06 10:40:03
